3603,983762674275556242,https://www.airbnb.com/rooms/983762674275556242,20240917031409,2024-09-17,city scrape,Il Giardino di Anna - via Treves,"Apartment in the Costa Zaragoza district, on the slopes of San Luca, in a quiet and peaceful location, a short distance from the Villa Chiara clinic (1.3 Km)<br />Renato Dall 'Ara stadium is a short walk away (1 km), the historic center is easily accessible by bus nr 20<br />The independent entrance from the private garden, the equipped kitchen, the living room with sofa bed, a double bedroom (total 4 beds) and the bathroom with washing machine make the ideal solution for short and long periods!","Just a 2-minute walk from the bus stop with frequent connections to the City Center (10 min) and the Fair Zone (20 min) and 500 meters from Dall 'Ara Stadium. Unipol Arena events and concerts, Highway and Tangenziale, Industrial Zone and Airport reachable in a few minutes by car . A few steps away, useful amenities such as Lava Tokens and 24-hour Supermarkets, pharmacy, bars, restaurants, pizzerias. A few meters away, Paddle courts. All in one area with communal gardens and free parking.",https://a0.muscache.com/pictures/99e36bfc-af39-407f-8e9b-49ac801e9267.jpg,537835418,https://www.airbnb.com/users/show/537835418,Anna,2023-09-19,,,within an hour,100%,94%,t,https://a0.muscache.com/im/pictures/user/User-537835418/original/34d778d6-c38f-43aa-9b2d-d3212526ea42.jpeg?aki_policy=profile_small,https://a0.muscache.com/im/pictures/user/User-537835418/original/34d778d6-c38f-43aa-9b2d-d3212526ea42.jpeg?aki_policy=profile_x_medium,,1,1,"['email', 'phone']",t,t,"Bologna, Emilia-Romagna, Italy",Borgo Panigale - Reno,,44.4898167,11.2983164,Entire rental unit,Entire home/apt,4,1.0,1 bath,1.0,2.0,"[""Bed linens"", ""Coffee maker: pour-over coffee"", ""Dining table"", ""Clothing storage: closet and dresser"", ""Essentials"", ""Hot water kettle"", ""Cleaning products"", ""Dishwasher"", ""Iron"", ""Body soap"", ""Heating"", ""Private entrance"", ""Refrigerator"", ""Free street parking"", ""Drying rack for clothing"", ""Hot water"", ""Room-darkening shades"", ""Dishes and silverware"", ""Private backyard \u2013 Fully fenced"", ""Cooking basics"", ""Freezer"", ""Dedicated workspace"", ""Smoking allowed"", ""Beko stainless steel single oven"", ""Outdoor dining area"", ""Washer"", ""Stainless steel gas stove"", ""Pets allowed"", ""Bidet"", ""TV"", ""Hair dryer"", ""Kitchen""]",$127.00,2,90,2,2,90,90,2.0,90.0,,t,26,51,81,97,2024-09-17,7,7,0,2023-10-08,2024-06-18,4.86,5.0,4.57,5.0,5.0,5.0,4.71,,f,1,1,0,0,0.61
3604,983764961293306354,https://www.airbnb.com/rooms/983764961293306354,20240917031409,2024-09-17,city scrape,The courts of via Fondazza (very central),"Le corti is a quiet and comfortable apartment with more than 4 beds and great flavor in the heart of Bologna.<br />A stone's throw from the most beautiful places in the city, the house allows easy access to everything that Bologna offers the visitor.<br />The two internal courtyards make it the silent and ideal place to relax and have lunch or dinner outdoors and make the house fresh and enjoyable even in the height of summer.<br />Book now to live an unforgettable experience in Bologna.","The Santo Stefano neighborhood is a quiet and prestigious neighborhood that takes its name from the famous Basilicas and Piazza Santo Stefano.<br />The most central part of the neighborhood is pedestrianized and full of places to taste the typical Bolognese cuisine, but also to enjoy an aperitif sitting outdoors and admiring the city.<br /><br />Very rich in services, well connected to both the railway station and the bus station which are less than 2 km away.<br />You will also notice many bicycles that you can rent by downloading the RideMovi App for free.",https://a0.muscache.com/pictures/b97b0c0e-591b-4aac-bd58-de75fa65a62b.jpg,537835756,https://www.airbnb.com/users/show/537835756,Anna,2023-09-19,"Bologna, Italy",,within an hour,100%,100%,t,https://a0.muscache.com/im/pictures/user/User-537835756/original/c12b110f-f496-4d34-b31b-b0717cfe7f2e.jpeg?aki_policy=profile_small,https://a0.muscache.com/im/pictures/user/User-537835756/original/c12b110f-f496-4d34-b31b-b0717cfe7f2e.jpeg?aki_policy=profile_x_medium,,1,1,"['email', 'phone']",t,t,"Bologna, Emilia-Romagna, Italy",Santo Stefano,,44.48728367917353,11.353477612137794,Entire rental unit,Entire home/apt,6,1.0,1 bath,2.0,5.0,"[""Bed linens"", ""Dining table"", ""Fire extinguisher"", ""Clothing storage: closet"", ""Hangers"", ""Paid pack \u2019n play/travel crib - always at the listing"", ""Essentials"", ""Hot water kettle"", ""Cleaning products"", ""Smart lock"", ""Dishwasher"", ""Iron"", ""Body soap"", ""Extra pillows and blankets"", ""Courtyard view"", ""Refrigerator"", ""Toaster"", ""Drying rack for clothing"", ""Hot water"", ""Folding or convertible high chair - available upon request"", ""Dishes and silverware"", ""Paid street parking off premises"", ""Private backyard \u2013 Fully fenced"", ""Baking sheet"", ""Cooking basics"", ""Freezer"", ""Free washer \u2013 In unit"", ""Dedicated workspace"", ""Ceiling fan"", ""Smoke alarm"", ""Single oven"", ""Self check-in"", ""Laundromat nearby"", ""Outdoor dining area"", ""Fast wifi \u2013 764 Mbps"", ""Single level home"", ""Shower gel"", ""Coffee"", ""Bidet"", ""Pets allowed"", ""Outdoor furniture"", ""Gas stove"", ""Central heating"", ""Hair dryer"", ""Kitchen"", ""Air conditioning"", ""Carbon monoxide alarm"", ""Coffee maker""]",$163.00,2,29,1,3,1125,1125,2.0,1125.0,,t,7,18,46,237,2024-09-17,60,60,5,2023-10-15,2024-09-15,4.88,4.88,4.88,4.97,4.98,4.93,4.82,IT037006C2O89ZN32R,f,1,1,0,0,5.31
3768,1019624987059884170,https://www.airbnb.com/rooms/1019624987059884170,20240917031409,2024-09-17,city scrape,Stanza grande via Emilia Ponente,Apartment with large rooms in the area great for all amenities and Bologna airport very close,,https://a0.muscache.com/pictures/9bc77521-93d3-44ba-ad44-3ab548aa70e1.jpg,88707458,https://www.airbnb.com/users/show/88707458,Anna,2016-08-08,"Bologna, Italy",Sono lieta di ospitarti nel mio appartamento,within an hour,100%,85%,f,https://a0.muscache.com/im/pictures/user/d785ed0e-1495-4585-a3d1-c5fd4bc58899.jpg?aki_policy=profile_small,https://a0.muscache.com/im/pictures/user/d785ed0e-1495-4585-a3d1-c5fd4bc58899.jpg?aki_policy=profile_x_medium,,5,5,"['email', 'phone', 'work_email']",t,t,,Borgo Panigale - Reno,,44.504698040680445,11.29823885858059,Private room in rental unit,Private room,1,1.0,1 bath,2.0,1.0,"[""First aid kit"", ""Iron"", ""Dedicated workspace"", ""Pets allowed"", ""Heating"", ""Wifi"", ""Private entrance"", ""Kitchen"", ""Elevator"", ""Hangers"", ""Lock on bedroom door"", ""Essentials""]",$79.00,3,365,3,3,365,365,3.0,365.0,,t,29,59,89,269,2024-09-17,0,0,0,,,,,,,,,,,f,5,0,5,0,
3831,1036063738885146049,https://www.airbnb.com/rooms/1036063738885146049,20240917031409,2024-09-17,city scrape,Labirint Central Suite Goito,"Enjoy a relaxing vacation in this downtown space. The apartment is located in the historic center, literally 280 meters from Via Dell 'Indipendenza and a 3-minute walk from Piazza Maggiore. It is a nice two-room apartment, consisting of a double bedroom, a living room with an open kitchen and a bathroom. There is a sofa bed that can be used to accommodate a third guest.","The apartment is located in the historic center (ZTL Zone), literally 280 meters from Via Dell 'Indipendenza and a 3-minute walk from Piazza Maggiore.<br />Multiple gastronomic offerings within walking distance, bars, restaurants, wineries…<br />About 100 meters away, a convenient supermarket on the adjacent Via Oberdan.<br />Tobacco shops, pharmacies, and the best shopping shops in Via Dell 'Indipendenza, as well as several bus stops to reach multiple destinations.<br />About a 15-minute walk to Central Station!",https://a0.muscache.com/pictures/hosting/Hosting-1036063738885146049/original/37394035-32a5-4bd3-a858-8a55aef34df3.jpeg,548811627,https://www.airbnb.com/users/show/548811627,Anna,2023-11-30,,,within an hour,100%,99%,t,https://a0.muscache.com/im/pictures/user/User-548811627/original/45f554bf-a015-474d-ac2f-f8d974389477.jpeg?aki_policy=profile_small,https://a0.muscache.com/im/pictures/user/User-548811627/original/45f554bf-a015-474d-ac2f-f8d974389477.jpeg?aki_policy=profile_x_medium,,1,1,"['email', 'phone']",t,t,"Bologna, Emilia-Romagna, Italy",Santo Stefano,,44.4967497,11.3452964,Entire rental unit,Entire home/apt,2,1.0,1 bath,1.0,1.0,"[""Dining table"", ""Fire extinguisher"", ""Clothing storage: closet"", ""Hangers"", ""Essentials"", ""Cleaning products"", ""City skyline view"", ""Dishwasher"", ""Iron"", ""Body soap"", ""Candy  stainless steel single oven"", ""Coffee maker: espresso machine"", ""Wine glasses"", ""Drying rack for clothing"", ""Hot water"", ""Room-darkening shades"", ""Dishes and silverware"", ""Paid parking garage off premises"", ""Cooking basics"", ""Wifi \u2013 18 Mbps"", ""Freezer"", ""Self check-in"", ""Smoke alarm"", ""Washer"", ""Smeg refrigerator"", ""Single level home"", ""Shower gel"", ""Coffee"", ""Bidet"", ""Lockbox"", ""Microwave"", ""TV"", ""Gas stove"", ""Central heating"", ""Elevator"", ""Hair dryer"", ""Kitchen"", ""Air conditioning"", ""Carbon monoxide alarm""]",$111.00,1,28,1,2,28,28,2.0,28.0,,t,1,7,28,28,2024-09-17,64,64,3,2023-12-10,2024-08-31,4.75,4.91,4.83,4.77,4.69,4.91,4.78,IT037006C2W44QZIHS,f,1,1,0,0,6.78
3873,1049041996639650983,https://www.airbnb.com/rooms/1049041996639650983,20240917031409,2024-09-17,city scrape,Eden,,,https://a0.muscache.com/pictures/hosting/Hosting-U3RheVN1cHBseUxpc3Rpbmc6MTA0OTA0MTk5NjYzOTY1MDk4Mw%3D%3D/original/31ea5a5f-80e8-4aa4-8cd5-73828fe0c14f.jpeg,551484328,https://www.airbnb.com/users/show/551484328,Anna,2023-12-18,,,within a few hours,100%,24%,f,https://a0.muscache.com/im/pictures/user/User-551484328/original/3f5115df-08bd-4451-b602-bfd32d27ea2a.jpeg?aki_policy=profile_small,https://a0.muscache.com/im/pictures/user/User-551484328/original/3f5115df-08bd-4451-b602-bfd32d27ea2a.jpeg?aki_policy=profile_x_medium,,2,2,"['email', 'phone']",t,t,,San Donato - San Vitale,,44.50651732098232,11.374856991540543,Private room in rental unit,Private room,2,1.0,1 bath,1.0,1.0,"[""Wifi"", ""Lock on bedroom door"", ""Paid parking on premises""]",$37.00,2,30,1,2,30,30,2.0,30.0,,t,5,16,38,86,2024-09-17,1,1,0,2024-03-23,2024-03-23,5.0,5.0,5.0,5.0,5.0,5.0,5.0,,f,2,0,2,0,0.17
3886,1050869153904149372,https://www.airbnb.com/rooms/1050869153904149372,20240917031409,2024-09-17,city scrape,Eden Camera 2,"Charming, spacious and cozy apartment on the second floor, accessible by self check-in and a short walk from Bologna Fiere and a 15-minute bus ride from Piazza Maggiore (Sirenella stop, below the house, line 20) and just 2 km from Sant 'Orsola.<br /><br />There are also all kinds of services nearby: hot boards, bars, trattorias, Coop supermarket and if that's not enough feel free to ask us!",,https://a0.muscache.com/pictures/hosting/Hosting-U3RheVN1cHBseUxpc3Rpbmc6MTA1MDg2OTE1MzkwNDE0OTM3Mg%3D%3D/original/ae026b3f-a973-4ee4-b2c8-ab1cf77e4f04.jpeg,551484328,https://www.airbnb.com/users/show/551484328,Anna,2023-12-18,,,within a few hours,100%,24%,f,https://a0.muscache.com/im/pictures/user/User-551484328/original/3f5115df-08bd-4451-b602-bfd32d27ea2a.jpeg?aki_policy=profile_small,https://a0.muscache.com/im/pictures/user/User-551484328/original/3f5115df-08bd-4451-b602-bfd32d27ea2a.jpeg?aki_policy=profile_x_medium,,2,2,"['email', 'phone']",t,t,,San Donato - San Vitale,,44.50573,11.37332,Private room in rental unit,Private room,2,1.0,1 shared bath,2.0,2.0,"[""Paid parking on premises"", ""Self check-in"", ""Lockbox"", ""Wifi"", ""Lock on bedroom door""]",$41.00,2,30,1,2,30,30,2.0,30.0,,t,2,16,35,77,2024-09-17,3,3,0,2024-02-25,2024-05-20,4.67,4.67,4.33,5.0,5.0,4.67,4.67,,f,2,0,2,0,0.44
4137,1096387919997923797,https://www.airbnb.com/rooms/1096387919997923797,20240917031409,2024-09-17,city scrape,Confortevole Bilocale zona Fiera,"Cute and quiet one-bedroom apartment in a fair area and not far from the historic center. Excellently served by public transport with bus stop in front of the apartment. <br />The accommodation is located on the ground floor of a building and can comfortably accommodate two people up to a maximum of three. It has a double bedroom with bathroom and a sofa bed in the living area. Complete the space with a kitchen stocked with everything you need, a TV, the free Wifi perfect for working from home.",,https://a0.muscache.com/pictures/miso/Hosting-1096387919997923797/original/a6cfb70b-e387-4fd8-abbd-eebce48de5a9.jpeg,201339024,https://www.airbnb.com/users/show/201339024,Anna,2018-07-10,Italy,"I love traveling, reading books and watching movies",a few days or more,0%,0%,f,https://a0.muscache.com/im/pictures/user/User-201339024/original/2c8cc00e-22ee-414f-b10a-9331f35b37cc.jpeg?aki_policy=profile_small,https://a0.muscache.com/im/pictures/user/User-201339024/original/2c8cc00e-22ee-414f-b10a-9331f35b37cc.jpeg?aki_policy=profile_x_medium,,1,1,"['email', 'phone']",t,t,,San Donato - San Vitale,,44.50403,11.36467,Entire rental unit,Entire home/apt,2,1.0,1 bath,1.0,2.0,"[""Paid parking on premises"", ""Dedicated workspace"", ""TV"", ""Wifi"", ""Host greets you"", ""Kitchen""]",$60.00,1,4,1,1,4,4,1.0,4.0,,t,0,0,29,203,2024-09-17,0,0,0,,,,,,,,,,,f,1,1,0,0,
